{
  "schemaVersion": "1.0.0",
  "syncProtocolVersion": "1.0.0",
  "payloadVersion": "1.0.0",
  "syncPackageId": "66666666-6666-4666-8666-666666666666",
  "sessionId": "11111111-1111-4111-8111-111111111111",
  "deviceId": "22222222-2222-4222-8222-222222222222",
  "createdAt": "2026-08-29T11:13:00Z",
  "sequence": 0,
  "totalSequences": 3,
  "checksum": "aaaaaaaaaaaaaaaaaaaaaaaaaaaaaaaaaaaaaaaaaaaaaaaaaaaaaaaaaaaaaaaa",
  "checksumAlgorithm": "sha256",
  "idempotencyKey": "22222222:11111111:0000",
  "sourcePlatform": "garmin",
  "compression": { "algorithm": "gzip", "uncompressedBytes": 245760 },
  "encryption": { "transportSecurity": "tls", "contentEncryption": "none" },
  "contentManifest": [
    {
      "contentType": "session_summary",
      "schemaVersion": "1.0.0",
      "itemCount": 1,
      "byteLength": 1536
    },
    {
      "contentType": "track",
      "schemaVersion": "1.0.0",
      "itemCount": 2000,
      "byteLength": 244224
    }
  ]
}
